{"body":{"adaptive_content":{"cross-behavior_shape_match":"candidate-possible-recolor-only","fixed_palette_for_platform_adaptive":"omitted","service_rgb_is_semantic":false,"shape_source":"alpha-mask"},"algorithm_ids":{"canonical_render":"canonical-layout-stream-v1","decoded_payload":"decoded-rgba-framed-v1","decoder_backend_fingerprint":"decoder-backend-v1","perceptual":"phash-dct32-q14-v1","shape":"binary-alpha-stream-v1"},"candidate_thresholds":{"adaptive_alpha_hamming_max":8,"adaptive_edge_hamming_max":8,"animation_median_hamming_max":6,"animation_p90_hamming_max":12,"candidate_limit_default":20,"candidate_limit_hard_max":100,"cyclic_alignment":true,"dtw_band_frames":2,"reverse_playback_match":false,"review_alpha_iou_min":"0.95","review_ssim_min":"0.98","speed_change_ratio":"1.15","static_alpha_hamming_max":12,"static_high_priority_alpha_hamming_max":8,"static_high_priority_primary_hamming_max":4,"static_primary_hamming_max":8},"canonical_render":{"algorithm":"sha256","background":"transparent-black","canvas_size":256,"content_box_size":224,"frame_scope":"all-fully-decoded-composited-frames","magic_utf8_nul":"MLXCR1","resize":"nearest-pixel-center-v1","stream":["u32-frame-count","u8-loop-mode","repeated-u64-duration-us","rgba8"]},"decoded_payload":{"algorithm":"sha256","frame":["u64-duration-us","u64-rgba-byte-length","rgba8-bytes"],"header":["u32-width","u32-height","u32-frame-count","u8-loop-mode"],"integer_byte_order":"big","loop_modes":{"loop":1,"once":0,"unknown":255},"magic_utf8_nul":"MLXDP1"},"decoder":{"alpha_representation":"unpremultiplied","color_space":"srgb","ffmpeg_versions":">=6,<9","icc_policy":"ignore-assume-srgb","orientation":"display-oriented","pillow_versions":">=11,<13","pixel_format":"straight-rgba8","rlottie_adapter":"mojilex-lossless-rgba-stream-v1","rlottie_surface_word":"0xAARRGGBB-premultiplied","rlottie_unpremultiply":{"alpha_intermediate":"straight_channel=min(255,(premultiplied_channel*255+alpha//2)//alpha)","alpha_opaque":"straight_channel=premultiplied_channel","alpha_zero":"rgba=0,0,0,0"},"supported_webm_codecs":["av1","vp8","vp9"],"transparent_rgb":"zero"},"decoder_backend_fingerprint":{"canonical_descriptor":"utf8-json-sort-keys-compact-v1","components":["media-kind","system","machine","python-implementation-version","pillow-version","relevant-codec-library-version","exact-external-executable-sha256","webm-codec-and-alpha-decode-mode"],"encoding":"sha256-lowercase-hex","path_policy":"excluded"},"low_information":{"edge_density_bp_max":50,"edge_threshold_u8":32,"luminance_entropy_millibits_max":250,"rule":"visible-area-or-luminance-entropy-or-edge-density","visible_area_bp_max":150},"normative_vectors":[{"expected":{"alpha_phash64":"gAAqACoAKgA","canonical_render_sha256":"8c119659cc6464ebf59003a532094597a0b1ac1bba09e67a67e64fd0c011292b","content_phash64":"gAAqACoAKgA","decoded_payload_sha256":"3ffd8d13aa7b53d9dc717059f2036c2957096d134b418aa0c17ff7bef92ca823","edge_phash64":"AAAAAAAAAAA","layout_phash64":"gAAqACoAKgA","low_information":true,"shape_sha256":"5655580898d12db1aa1e91048bf612fa65e8f5cdbdac176607d014edcf0748f0","temporal_energy_bp":0},"id":"opaque-red-2x2","input":{"duration_us":[0],"frame_count":1,"height":2,"loop_mode":"once","rgba_hex":["ff0000ffff0000ffff0000ffff0000ff"],"width":2}},{"expected":{"alpha_phash64":"xMQ7OzvAOTs","canonical_render_sha256":"2bfea143ad53c44fd54df30b832614af9daf5e088ac19a131ca057c42f345efe","content_phash64":"xMQ7OzvAOTs","decoded_payload_sha256":"381edb7001f429677089edb61cb8a960d48b6979109540d5fda89fb53dde4089","edge_phash64":"AAAAAAAAAAA","layout_phash64":"xMQ7OzvAOTs","low_information":true,"shape_sha256":"c737282757d633adc93f2c7ee69c6271387abad7b7a8c19bfb63f2a5c8687da7","temporal_energy_bp":0},"id":"transparent-hidden-rgb-2x2","input":{"duration_us":[0],"frame_count":1,"height":2,"loop_mode":"once","rgba_hex":["ff0000ff112233001122330011223300"],"width":2}}],"oversized_bucket_policy":{"low_information_shape_bucket":"suppress","pairwise_expansion":false,"posting_bucket_cap":4096,"probe_budget_per_item":50000,"remaining_overflow":"suppress-and-report-deterministic-reason","secondary_keys":["content-phash-prefix-16","edge-phash-prefix-16"]},"perceptual":{"animated_sample_count":16,"content":"visible-bbox-alpha16-plus-ceil-5pct-margin-fit-224-on-transparent-256","edge":"abs-horizontal-plus-abs-vertical-clamped-u8","encoding":"u64be-base64url-nopad","layout":"full-native-canvas-fit-224-on-transparent-256","luminance":"integer-bt601-times-alpha","phash":"dct32-low8-fixed-cosine-q14-median-ac-v1","sample_times":"t_i=(i+0.5)*D/N","static_sample_count":1,"temporal_energy":"mean-absolute-layout-luma-delta;cyclic-for-loop;basis-points-half-up"},"resource_limits":{"max_decoded_rgba_bytes":1500000000,"max_frame_metadata_bytes":4194304,"max_full_frames":600},"shape":{"algorithm":"sha256","alpha_threshold_u8":16,"magic_utf8_nul":"MLXSH1","stream":["u32-frame-count","u8-loop-mode","repeated-u64-duration-us","binary-alpha-u8"]}},"contract_schema_ref":"mlx://schemas/distribution/v1/dedupe-profile-contract.schema.json","contract_schema_sha256":"63000b5b17ef22b3d1acf72aed4be1cf995b5113eb3ba969c5759d6487f3d7a3","profile_id":"dedupe-v1","profile_schema_version":"1.0.0","profile_type":"dedupe"}